{
  "computation": {
    "cell_metric": "G_ij = a_i dot a_j",
    "cell_volume": "absolute determinant of the scaled 3x3 lattice matrix",
    "generator": "scripts/generate_benchmark_tiers.py",
    "poscar_scale": "one positive scalar applied to all lattice vectors",
    "rounding_decimal_places": 10
  },
  "description": "Recomputable fixed-file structural quantities for parser and conversion regression tests.",
  "id": "structural-invariants-v1",
  "records": [
    {
      "id": "mst-bulk-cod-000001",
      "invariants": {
        "cell_metric_tensor_angstrom2": [
          [
            57.3049,
            12.0157406453,
            -8.9186490552
          ],
          [
            12.0157406453,
            51.251281,
            -8.9606583333
          ],
          [
            -8.9186490552,
            -8.9606583333,
            17.875984
          ]
        ],
        "cell_volume_angstrom3": 207.756195499,
        "composition_counts": {
          "I": 2,
          "Sb": 2,
          "Te": 2
        },
        "lattice_vector_lengths_angstrom": [
          7.57,
          7.159,
          4.228
        ],
        "number_of_atoms": 6,
        "number_of_species": 3
      },
      "license": "CC0-1.0",
      "path": "structures/bulk/cod/1008205.vasp",
      "property_claim_status": "pending",
      "review_status": "reviewed",
      "sha256": "2a4017140a516b80cf796565a8a46ef6cfe4157238bf175adc44b49dee0347ac"
    },
    {
      "id": "mst-bulk-cod-000003",
      "invariants": {
        "cell_metric_tensor_angstrom2": [
          [
            33.605209,
            -16.8026045,
            0.0
          ],
          [
            -16.8026045,
            33.605209,
            0.0
          ],
          [
            0.0,
            0.0,
            768.620176
          ]
        ],
        "cell_volume_angstrom3": 806.8505931622,
        "composition_counts": {
          "As": 6,
          "Cd": 3,
          "K": 12
        },
        "lattice_vector_lengths_angstrom": [
          5.797,
          5.797,
          27.724
        ],
        "number_of_atoms": 21,
        "number_of_species": 3
      },
      "license": "CC0-1.0",
      "path": "structures/bulk/cod/1008853.vasp",
      "property_claim_status": "pending",
      "review_status": "reviewed",
      "sha256": "1fc0cd7c6aea945a4e86134829889f02d3838bb518cf5b7178013292db3665ee"
    },
    {
      "id": "mst-bulk-cod-000004",
      "invariants": {
        "cell_metric_tensor_angstrom2": [
          [
            39.1876,
            -19.5938,
            0.0
          ],
          [
            -19.5938,
            39.1876,
            0.0
          ],
          [
            0.0,
            0.0,
            331.24
          ]
        ],
        "cell_volume_angstrom3": 617.6617194628,
        "composition_counts": {
          "Br": 18,
          "Cr": 6
        },
        "lattice_vector_lengths_angstrom": [
          6.26,
          6.26,
          18.2
        ],
        "number_of_atoms": 24,
        "number_of_species": 2
      },
      "license": "CC0-1.0",
      "path": "structures/bulk/cod/1010151.vasp",
      "property_claim_status": "pending",
      "review_status": "reviewed",
      "sha256": "ffd34fb8a84cca47d1a2b48dba04e377eef5ae9af467ef3543ad171dd5025a33"
    },
    {
      "id": "mst-bulk-cod-000006",
      "invariants": {
        "cell_metric_tensor_angstrom2": [
          [
            19.245769,
            -9.6228845,
            0.0
          ],
          [
            -9.6228845,
            19.245769,
            0.0
          ],
          [
            0.0,
            0.0,
            60.9961
          ]
        ],
        "cell_volume_angstrom3": 130.1718072298,
        "composition_counts": {
          "As": 2,
          "Li": 6
        },
        "lattice_vector_lengths_angstrom": [
          4.387,
          4.387,
          7.81
        ],
        "number_of_atoms": 8,
        "number_of_species": 2
      },
      "license": "CC0-1.0",
      "path": "structures/bulk/cod/1010288.vasp",
      "property_claim_status": "pending",
      "review_status": "reviewed",
      "sha256": "1ca3c7997d6a15be993713062380620a6dcf99037a77ec2fcb73248c690740a1"
    },
    {
      "id": "mst-bulk-cod-000008",
      "invariants": {
        "cell_metric_tensor_angstrom2": [
          [
            17.0569,
            -8.52845,
            0.0
          ],
          [
            -8.52845,
            17.0569,
            0.0
          ],
          [
            0.0,
            0.0,
            44.7561
          ]
        ],
        "cell_volume_angstrom3": 98.8227312686,
        "composition_counts": {
          "Ge": 1,
          "I": 2
        },
        "lattice_vector_lengths_angstrom": [
          4.13,
          4.13,
          6.69
        ],
        "number_of_atoms": 3,
        "number_of_species": 2
      },
      "license": "CC0-1.0",
      "path": "structures/bulk/cod/1010319.vasp",
      "property_claim_status": "pending",
      "review_status": "reviewed",
      "sha256": "f2a9efc523ab1b6683b5a52b0e1718623ff3ca66906cfc40443ea269de94bdec"
    },
    {
      "id": "mst-bulk-cod-000010",
      "invariants": {
        "cell_metric_tensor_angstrom2": [
          [
            228.523689,
            0.0,
            -56.0801367
          ],
          [
            0.0,
            18.826921,
            0.0
          ],
          [
            -56.0801367,
            0.0,
            50.41
          ]
        ],
        "cell_volume_angstrom3": 397.0812666213,
        "composition_counts": {
          "Au": 2,
          "I": 8,
          "Li": 2
        },
        "lattice_vector_lengths_angstrom": [
          15.117,
          4.339,
          7.1
        ],
        "number_of_atoms": 12,
        "number_of_species": 3
      },
      "license": "CC0-1.0",
      "path": "structures/bulk/cod/1510187.vasp",
      "property_claim_status": "pending",
      "review_status": "reviewed",
      "sha256": "cea87afc7bcffdf636db6a4d6bf567f3e77e77254e34672f0271540282f0788d"
    },
    {
      "id": "mst-bulk-cod-000012",
      "invariants": {
        "cell_metric_tensor_angstrom2": [
          [
            69.806025,
            0.0,
            -14.4474045633
          ],
          [
            0.0,
            13.417569,
            0.0
          ],
          [
            -14.4474045633,
            0.0,
            39.212644
          ]
        ],
        "cell_volume_angstrom3": 184.192865376,
        "composition_counts": {
          "Au": 4,
          "Se": 4
        },
        "lattice_vector_lengths_angstrom": [
          8.355,
          3.663,
          6.262
        ],
        "number_of_atoms": 8,
        "number_of_species": 2
      },
      "license": "CC0-1.0",
      "path": "structures/bulk/cod/1510294.vasp",
      "property_claim_status": "pending",
      "review_status": "reviewed",
      "sha256": "3f2255429b90dfe10608af5059063e56c960deafa19320ee75fc03f667f3315d"
    },
    {
      "id": "mst-bulk-cod-000014",
      "invariants": {
        "cell_metric_tensor_angstrom2": [
          [
            23.76952516,
            0.0,
            -15.9331861168
          ],
          [
            0.0,
            7.91915881,
            0.0
          ],
          [
            -15.9331861168,
            0.0,
            31.158724
          ]
        ],
        "cell_volume_angstrom3": 62.0865753811,
        "composition_counts": {
          "Ni": 2,
          "O": 4
        },
        "lattice_vector_lengths_angstrom": [
          4.8754,
          2.8141,
          5.582
        ],
        "number_of_atoms": 6,
        "number_of_species": 2
      },
      "license": "CC0-1.0",
      "path": "structures/bulk/cod/1522025.vasp",
      "property_claim_status": "pending",
      "review_status": "reviewed",
      "sha256": "98e98461223083e39553376547dcd1ff2f21a4d705dbf87636854cf0cec9eb2b"
    },
    {
      "id": "mst-bulk-cod-000017",
      "invariants": {
        "cell_metric_tensor_angstrom2": [
          [
            39.69,
            0.0,
            -12.80592407
          ],
          [
            0.0,
            120.5604,
            0.0
          ],
          [
            -12.80592407,
            0.0,
            40.1956
          ]
        ],
        "cell_volume_angstrom3": 415.4115325928,
        "composition_counts": {
          "Br": 12,
          "Ir": 4
        },
        "lattice_vector_lengths_angstrom": [
          6.3,
          10.98,
          6.34
        ],
        "number_of_atoms": 16,
        "number_of_species": 2
      },
      "license": "CC0-1.0",
      "path": "structures/bulk/cod/1527188.vasp",
      "property_claim_status": "pending",
      "review_status": "reviewed",
      "sha256": "5b3f0c18f5ff923454e057913c2a07338e82be4b80ffea96ff330986d3ef5058"
    },
    {
      "id": "mst-bulk-cod-000038",
      "invariants": {
        "cell_metric_tensor_angstrom2": [
          [
            17.065161,
            9.9903670518,
            9.9903670518
          ],
          [
            9.9903670518,
            17.065161,
            9.9903670518
          ],
          [
            9.9903670518,
            9.9903670518,
            17.065161
          ]
        ],
        "cell_volume_angstrom3": 43.0609733105,
        "composition_counts": {
          "As": 2
        },
        "lattice_vector_lengths_angstrom": [
          4.131,
          4.131,
          4.131
        ],
        "number_of_atoms": 2,
        "number_of_species": 1
      },
      "license": "CC0-1.0",
      "path": "structures/bulk/cod/9008574.vasp",
      "property_claim_status": "pending",
      "review_status": "reviewed",
      "sha256": "779e40f436a0f05cf6d2aed15d6c2665a97d635e4d1b3562dc4648ccf6ffae7c"
    },
    {
      "id": "mst-bulk-cod-000041",
      "invariants": {
        "cell_metric_tensor_angstrom2": [
          [
            17.3056,
            -8.6528,
            0.0
          ],
          [